Title,Department,Description,Salary Range,Remote Policy,Status
Senior Software Engineer,Engineering,"We're looking for a Senior Software Engineer to join our platform team. You'll design and build scalable backend systems using Python and Azure. Requirements: 5+ years of backend engineering experience, strong Python skills, experience with cloud infrastructure (Azure preferred), familiarity with React for occasional front-end work. We value clear communication and collaborative problem-solving. You'll work with a team that ships regularly and reviews each other's code carefully.","$145,000 - $175,000",Hybrid,Draft
Marketing Rockstar,Marketing,"Are you a marketing ninja who lives and breathes social media? We need a rockstar who is passionate about brand storytelling. He will lead our content calendar and drive viral campaigns. Must be able to hustle in a fast-paced environment. Responsibilities include managing all social channels, creating engaging content, and crushing KPIs.",,Remote,Draft
Financial Analyst,Finance,"The Financial Analyst will support the FP&A function by building models, preparing monthly close reports, and contributing to the annual budget process. Requirements: Bachelor's degree in Finance or Accounting, proficiency in Excel, familiarity with ERP systems, experience with financial reporting, ability to manage multiple projects simultaneously, attention to detail, strong communication skills, comfortable with ambiguity, team player, experience with variance analysis, knowledge of GAAP accounting principles, experience with SQL a plus, CPA or CFA a plus, 2+ years in a finance role.",,Hybrid,Draft
Sales Development Representative,Sales,"Join our sales team as an SDR. You'll prospect into new accounts, qualify inbound leads, and book meetings for account executives. Requirements: 3-5 years of B2B sales experience, familiarity with Salesforce, excellent communication skills, ability to work in a fast-paced environment. This is an entry-level role with a clear path to Account Executive.","$52,000 - $62,000 + commission",Remote,Under Review
Head of People Operations,HR,"Zava is looking for a Head of People Operations to lead our HR function through our next phase of growth. You will synergize cross-functional stakeholder alignment to drive organizational effectiveness. Responsibilities: oversee recruiting, onboarding, performance management, benefits administration, and employee relations. Requirements: 8+ years of HR leadership experience, strong employment law knowledge, experience scaling HR in a growth-stage company. Salary range included — we are serious about pay transparency.","$135,000 - $155,000",Hybrid,Draft
Operations Coordinator,Operations,We need someone to help with operations. Must be detail-oriented.,,,Draft
